rank,title,description,date
158,沖縄の大型商業施設「iias沖縄豊崎」、2020年4月下旬オープン,大和ハウス工業（株）はこのたび、沖縄県に開発する大型商業施設の名称を「iias（イーアス）沖縄豊崎」に決定した。開業は2020年4月下旬の予定。,2019年12月10日 (火)
159,高額マンション居住者、約47%が「つい無駄遣いをしてしまうことがある」,"（株）読売広告社都市生活研究所はこのたび、高額マンション居住者（7,000万円～1億2,000万円マンション購入層）の生活者像と、その消費スタイルの調査・研究を行った。",2019年12月10日 (火)
160,新築一戸建て平均価格、首都圏は3ヵ月連続上昇,（株）東京カンテイは12月9日、2019年11月度「新築木造一戸建て住宅平均価格」を発表した。,2019年12月10日 (火)
161,中古一戸建て価格、首都圏は2ヵ月連続上昇,（株）東京カンテイは12月9日、2019年11月度「中古木造一戸建て住宅平均価格」を発表した。,2019年12月10日 (火)
162,新築小規模一戸建て価格、首都圏は反転上昇,（株）東京カンテイは12月9日、2019年11月度「新築小規模木造一戸建て住宅平均価格」を発表した。,2019年12月10日 (火)
163,年末の大掃除、50.3%が家族で行う,アイロボットジャパン合同会社（東京都千代田区）はこのほど、「年末の大掃除に関する意識調査」の結果を発表した。調査は2019年11月16日～18日、20～50代の既婚有職男女800名を対象にインタ...,2019年12月6日 (金)
164,年末年始の過ごし方、約半数は「自宅でゆっくり休む」,（株）エアトリ（東京都新宿区）はこのたび、20代～70代の男女を対象に「年末年始の過ごし方」に関するアンケート調査を行った。調査は2019年11月17日～11月20日にインターネットで実施。963...,2019年12月6日 (金)
165,新生「東急プラザ渋谷」グランドオープン,東急不動産（株）は12月5日、渋谷駅西口エリアの渋谷フクラス内に、新生「東急プラザ渋谷」をグランドオープンした。,2019年12月6日 (金)
166,豊洲の新商業施設「江戸前場下町」、1月24日オープン,三井不動産（株）は、東京・豊洲エリアで進める「千客万来施設事業用地（5街区）を活用した賑わい創出事業」の商業施設名称を「江戸前場下町（えどまえじょうかまち）」とし、2020年1月24日...,2019年12月6日 (金)
167,都内の住宅着工数、2か月連続減少,東京都は12月5日、「令和元年10月の新設住宅着工」を発表した。,2019年12月6日 (金)
168,デュアルライフ・二拠点生活[22] 東京と長野県松本市。温泉街の一軒家を…,向井さんは、平日は東京で仕事をし、週末は妻と息子が住む長野県松本市にある浅間温泉で築50年の家をリノベしながら過ごすという、二拠点生活を送っている。その暮らしぶり、二拠点生活を始...,2019年12月6日 (金)
169,分譲マンションのシェアリングサービス、ついに傘も登場！,分譲マンション、特に居住者の多い大規模なマンションで、各種のシェアリングサービスが広がっている。そしてついに、身近な「傘」のシェアリングサービスも開始される。詳しく見ていこう。,2019年12月4日 (水)
170,【フラット35】金利、2ヵ月連続上昇,（独）住宅金融支援機構は2日、2019年12月の住宅ローン【フラット35】等の金利を発表した。,2019年12月3日 (火)
171,「豊洲ベイサイドクロス」、4月24日に街びらき,三井不動産（株）は、豊洲二丁目駅前地区（東京都江東区）で推進している「（仮称）豊洲二丁目駅前地区第一種市街地再開発事業2-1街区 AC棟計画」の街区名を「豊洲ベイサイドクロス」とし、2...,2019年12月3日 (火)
172,東京・日本橋エリアで「アバター」の都市実装共同事業,三井不動産（株）とANAホールディングス（株）（ANAHD）は、東京・日本橋エリアにおいて、「アバター」の都市実装共同事業を12月より開始する。,2019年12月3日 (火)
173,有明の大規模複合開発、街区名称は「有明ガーデン」に決定,住友不動産（株）はこのたび、東京湾岸有明複合開発プロジェクト（東京都江東区）の街区名称を「有明ガーデン」とし、その計画概要を発表した。,2019年12月3日 (火)
174,リバースモーゲージ型住宅ローン、申込は「年金受給者」が6割超,（独）住宅金融支援機構はこのたび、リバースモーゲージ型住宅ローン【リ・バ ース６０】における2019年7月から9月までの利用実績等を発表した。,2019年12月3日 (火)
175,住宅着工戸数、4か月連続減少,"国土交通省はこのたび、2019年10月の住宅着工統計を発表した。それによると、10月の住宅着工戸数は前年同月比7.4%減の7万7,123戸、4か月連続の減少となった。",2019年12月3日 (火)
176,奄美大島の空き家をみんなでDIY。街のみんなの夢をかなえる場になるまで,あるときはアロマ教室、またあるときは居酒屋や人狼ゲーム会場……。奄美大島の集落にある一軒の古民家が、世代を超えて地域の人々をつなげる場を提供している。今回は、この『HUB a nice d!』...,2019年12月3日 (火)
177,台風被害からみえてきた、災害に備えた家づくり,台風15号や19号は、全国各地に大きな被害をもたらしました。神奈川県の一部や千葉県では、建物の屋根が飛び浸水するなどの事例が多数確認されています。,2019年12月2日 (月)
178,東京23区の家賃相場が安い駅ランキング 2019年版,東京の家賃は、高額だ。特に23区の家賃相場の高さはよく知られているが、その中でも穴場の街や、狙い目の駅はあるはず。そこで、ワンルーム・1K・1DKの物件を対象とした、東京23区内の家賃相...,2019年12月2日 (月)
179,近所に空き家、4割超が「特に何とも思わない」,リビン・テクノロジーズ（株）はこのたび、30歳以上の男女を対象に「空き家の問題・対策」についてアンケート調査を行った。調査は2019年10月31日～11月11日、インターネットで実施。回答数...,2019年11月29日 (金)
180,金沢八景に駅直結型商業施設、2月28日オープン,京浜急行電鉄（株）（京急電鉄）は、金沢八景駅（横浜市金沢区）において、駅直結型商業施設「ウィングキッチン金沢八景」を2020年2月28日（金）にオープンする。,2019年11月29日 (金)
181,首都圏の単身生活者、病気・ケガへの備えは平均43.4点,（株）FJネクスト（東京都新宿区）はこのたび、「病気・ケガへの備え」をテーマに、首都圏の単身生活者「生活事情」アンケート第7弾を実施した。,2019年11月29日 (金)
182,中古マンション価格、下落地域数が増加,（株）東京カンテイは11月27日、2019年10月度「中古マンション価格天気図」を発表した。これは、全国47都道府県のファミリータイプ中古マンション流通事例価格を月ごとに集計し、価格変動を...,2019年11月29日 (金)
183,不動産価格指数、住宅総合は57ヶ月連続上昇,国土交通省はこのたび、2019年8月の「不動産価格指数（住宅）」と第2四半期分「不動産価格指数（商業用不動産）」を発表した。指数は2010年の平均を100としたもの。,2019年11月29日 (金)
184,サブスク型住居サービス「ADDress」を体験。暮らしの新たな価値を見た,「デュアラー（二拠点生活者）」、家を持たない暮らしを送る「アドレスホッパー」など、ひとつの家に留まらない暮らしが注目を集めています。そんななか、定額で全国のゲストハウスやシェア...,2019年11月29日 (金)
185,「タイニーハウス」での暮らしとは？ 日本の最先端が集結,近年、日本でも広がりを見せつつある「タイニーハウス」。「断捨離」を経ての「ミニマム」な生活に憧れ、自分のライフスタイルを簡潔にしたいと考える人は多いようだ。タイニーハウスは、ま...,2019年11月28日 (木)
186,住宅購入はじっくりと。増税前に購入したいと考えた人は昨年より大幅ダウン,リクルート住まいカンパニーの「2019年注文住宅動向・トレンド調査」によると、消費税率10％への増税の影響で、増税前に家を建てたいという人は少なかったという。一方で、防災については意...,2019年11月27日 (水)
187,「ワーケーション」がJALを変えた。地域と出合い、自分を見直す働き方,テレワークの新しい形として広がっている「ワーケーション」。「ワーク」と「バケーション」を組み合わせた造語で、休暇を兼ねて出かけた先でリモートワークを行う新しいワークスタイルであ...,2019年11月27日 (水)
188,「虎ノ門ヒルズ駅」と一体の再開発事業が着工,森ビル（株）は11月25日、同社が参加組合員として参画する「虎ノ門一・二丁目地区第一種市街地再開発事業」（東京都港区）の着工を発表した。,2019年11月26日 (火)
189,日本人の不安、「老後の生活や年金」が8年連続トップ,セコム（株）はこのたび、「日本人の不安に関する意識調査」を行った。調査は2019年10月25日～27日、インターネットで実施。対象は20代以上の男女500名（20-29歳、30-39歳、40-49歳、50-59歳...,2019年11月26日 (火)
